reference,petitioner,year,topic,petition_type,petition_gender,response,date2
QJF 106/3/97,"John Elless of Ince, labourer",1678,cottage,single,male,granted,1678
QJF 106/3/98,"John Gleave of Handford, labourer",1678,cottage,single,male,rejected,1678
QJF 106/3/99,"Thomas Portington, gentleman, and Thomas Pulford.",1678,litigation,multiple,male,no response,1678
QJF 106/3/100,the inhabitants of Monks Coppenhall in support of William Brereton,1678,cottage,collective,male,no response,1678
QJF 106/3/101,William Brereton,1678,cottage,single,male,no response,1678
QJF 115/4/4,"Richard Shaw of Marbury, labourer",1688,cottage,single,male,partly granted,1688
QJF 115/4/10,"Robert Wilson and Joseph Millington, overseers of the poor of Hartford",1688,poor relief,multiple,male,rejected,1688
QJF 115/4/11,"Mary Clouds widow, formerly Mary Porter of Newchurch",1688,cottage,single,female,granted,1688
QJF 115/4/27,the prisoners for debt in Chester Castle,1688,officeholding,collective,na,partly granted,1688
QJF 115/4/28,John Pemberton,1688,poor relief,single,male,granted,1688
QJF 115/4/30,"Shusana Blackley of Northwich, widow",1688,poor relief,single,female,rejected,1688
QJF 115/4/31,"Richard Eaton of t. Northwich, glover",1688,poor relief,single,male,rejected,1688
QJF 115/4/32,"Lawrence Booth and Richard Hatton, constable and deputy constable of Chester Castle",1688,litigation,multiple,male,no response,1688
QJF 115/4/59,"Katherine Booth of p. Barrowe, spinster",1688,paternity,single,female,no response,1688
QJF 115/4/93,"Elizabeth Wrensham of Deanevon in Bollinfee, spinster",1688,litigation,single,female,uncertain,1688
QJF 116/1/26,the inhabitants and overseers of the poor of t. Wibunbury,1688,rates,collective,na,granted,1688
QJF 116/2/7,Henry Gibons of t. Hodleston in p. Acton,1688,poor relief,single,male,granted,1688
QJF 116/2/9,"John Wright of Baddeley, labourer",1688,cottage,single,male,rejected,1688
QJF 116/2/23,John Downworth late of Cuddington,1688,poor relief,single,male,rejected,1688
QJF 116/2/28,Richard Reeve and Sarah his wife,1688,poor relief,multiple,mixed,granted,1688
QJF 116/2/40,the township of Runcorne,1688,rates,collective,na,granted,1688
QJF 116/3/2,Ellen Worrall,1688,poor relief,single,female,granted,1688
QJF 116/3/6,Thomas Taylor of Worleston,1688,poor relief,single,male,granted,1688
QJF 116/3/22,Edward Bayley,1688,poor relief,single,male,granted,1688
QJF 116/3/23,William Norbury of Eaton and Ann his wife,1688,poor relief,multiple,mixed,granted,1688
QJF 116/3/24,"Matthias Thurston of Nantwich, bookseller",1688,officeholding,single,male,no response,1688
QJF 116/3/25,"Ellenor Alcocke, a prisoner in Chester Castle",1688,litigation,single,female,no response,1688
QJF 116/3/26,"William Judson of Nantwich, gent",1688,officeholding,single,male,no response,1688
QJF 116/3/55,the inhabitants of Plumley and Little Peover in h. Bucklow,1688,rates,collective,na,granted,1688
QJF 125/4/8,"Anne Stube of Witton, widow.",1698,poor relief,single,female,granted,1698
QJF 125/4/9,"Elin Ryse of Northwich, widow",1698,poor relief,single,female,granted,1698
QJF 125/4/10,"Mary Brooks of Northwich, widow",1698,poor relief,single,female,granted,1698
QJF 125/4/11,"James Feild of Northwich, labourer.",1698,poor relief,single,male,granted,1698
QJF 126/1/2,"Richard Wood senior, a prisoner for debt in the castle of Chester",1698,poor relief,single,male,granted,1698
QJF 126/1/3,"Robert Lomas, a poor prisoner in Chester gaol",1698,poor relief,single,male,granted,1698
QJF 126/1/7,"Richard Massey, a poor prisoner in Chester castle",1698,poor relief,single,male,granted,1698
QJF 136/2/56,"The rector, churchwardens and parishioners of Ashton Super Mercey",1708,charitable brief,collective,na,no response,1700s
QJF 136/2/62,Thomas Wilbraham of Worleston,1708,charitable brief,single,male,no response,1700s
QJF 146/1/22,Samuel Hall,1718,officeholding,single,male,granted,1700s
QJF 146/2/58,Samuel Hall,1718,officeholding,single,male,granted,1700s
QJF 146/3/93,Richard Walthall,1718,other,single,male,no response,1700s
QJF 166/1/47,Daniell Dentith,1738,employment,single,male,granted,1700s
QJF 166/2/70,Robert Owen,1738,litigation,single,male,no response,1700s
QJF 186/1/81,Samuel Dixon,1758,litigation,single,male,no response,1700s
QJF 186/3/93,Samuel Dixon,1758,litigation,single,male,granted,1700s
QJF 186/4/103,Thomas Goulden,1758,dissenting worship,single,male,no response,1700s
QJF 206/2/12,Joseph Allen,1778,poor relief,single,male,granted,1700s
QJF 206/2/174,Richard Daviss,1778,charitable brief,single,male,no response,1700s
QJF 206/3/205,George Downing,1778,other,single,male,uncertain,1700s
QJF 206/4/112,Randle Bennett,1778,litigation,single,male,uncertain,1700s
QJF 226/2/85,John Nunns,1798,other,single,male,uncertain,1700s
QJF 226/2/86,"The minister, churchwardens and principal inhabitants of Church Lawton",1798,charitable brief,collective,na,no response,1700s
QJF 226/2/87,The justices of the peace of Cheshire,1798,charitable brief,collective,na,no response,1700s
QJF 226/3/8,William Hay,1798,dissenting worship,single,male,no response,1700s
QJD 2,Benjamin Ellis and other creditors of John Ellis,1798,other,single,male,granted,1700s
QJF 156/2/1,Mary Copland,1728,litigation,single,female,no response,1700s
QJF 156/2/2,Nathaniel Leftwiche and Mary Leftwiche,1728,litigation,multiple,mixed,no response,1700s
QJF 176/3/77,"James Hudson, Nathaniel Royle and others",1748,dissenting worship,multiple,male,no response,1700s
QJF 176/3/78,"John Kelsall, John Line and others",1748,dissenting worship,multiple,male,no response,1700s
QJF 196/2/3,John James and Samuel Gloster,1768,officeholding,multiple,male,no response,1700s
QJF 196/2/90,"Thomas Davis, Mr John Priestly and others",1768,dissenting worship,multiple,male,no response,1700s
QJF 196/3/128,Anne Robinson and Mary Person,1768,charitable brief,multiple,female,no response,1700s
QJF 216/4/88,The minister and churchwardens of Nantwich,1788,charitable brief,collective,na,no response,1700s
